{
  "id": "RE-2026-0054",
  "typeCode": "380",
  "issueDate": "2026-07-17",
  "dueDate": "2026-08-16",
  "currencyCode": "EUR",
  "businessProcessType": "urn:fdc:peppol.eu:2017:poacc:billing:01:1.0",
  "buyerReference": "04011000-12345-03",

  "seller": {
    "name": "Bauunternehmen Krause GmbH",
    "vatId": "DE123456789",
    "address": {
      "line1": "Baustraße 5",
      "city": "Berlin",
      "postalCode": "10117",
      "countryCode": "DE"
    },
    "electronicAddress": "rechnung@krause-bau.example",
    "electronicAddressSchemeId": "EM",
    "contact": {
      "name": "Buchhaltung",
      "telephone": "+49 30 1234567",
      "email": "buchhaltung@krause-bau.example"
    }
  },

  "buyer": {
    "name": "Acme GmbH",
    "vatId": "DE987654321",
    "address": {
      "line1": "Marienplatz 1",
      "city": "München",
      "postalCode": "80331",
      "countryCode": "DE"
    },
    "electronicAddress": "einkauf@acme.example",
    "electronicAddressSchemeId": "EM"
  },

  "lines": [
    {
      "id": "1",
      "name": "Bauleistung (Trockenbauarbeiten)",
      "description": "Bauleistung im Sinne des §13b Abs. 2 Nr. 4 UStG (Reverse-Charge)",
      "quantity": 1,
      "unitCode": "C62",
      "unitPrice": 2500.0,
      "lineAmount": 2500.0,
      "vatCategoryCode": "AE",
      "vatRate": 0
    }
  ],

  "vatBreakdowns": [
    {
      "categoryCode": "AE",
      "rate": 0,
      "taxableAmount": 2500.0,
      "taxAmount": 0.0,
      "exemptionReason": "Steuerschuldnerschaft des Leistungsempfängers für Bauleistungen gem. §13b UStG",
      "exemptionReasonCode": "VATEX-EU-AE",
      "reverseChargeReason": "construction"
    }
  ],

  "taxExclusiveAmount": 2500.0,
  "taxAmount": 0.0,
  "taxInclusiveAmount": 2500.0,
  "duePayableAmount": 2500.0,

  "paymentMeans": {
    "code": "58",
    "iban": "DE89370400440532013000",
    "accountName": "Bauunternehmen Krause GmbH",
    "bic": "COBADEFFXXX"
  },

  "note": "Steuerschuldnerschaft des Leistungsempfängers (§13b UStG, Bauleistungen)."
}
