{
  "id": "RE-2026-0055",
  "typeCode": "380",
  "issueDate": "2026-07-18",
  "dueDate": "2026-08-17",
  "currencyCode": "EUR",
  "businessProcessType": "urn:fdc:peppol.eu:2017:poacc:billing:01:1.0",
  "buyerReference": "04011000-12345-03",

  "seller": {
    "name": "Schrotthandel Weber GmbH",
    "vatId": "DE123456789",
    "address": {
      "line1": "Industriestraße 12",
      "city": "Duisburg",
      "postalCode": "47051",
      "countryCode": "DE"
    },
    "electronicAddress": "rechnung@weber-schrott.example",
    "electronicAddressSchemeId": "EM",
    "contact": {
      "name": "Buchhaltung",
      "telephone": "+49 203 1234567",
      "email": "buchhaltung@weber-schrott.example"
    }
  },

  "buyer": {
    "name": "Acme GmbH",
    "vatId": "DE987654321",
    "address": {
      "line1": "Marienplatz 1",
      "city": "München",
      "postalCode": "80331",
      "countryCode": "DE"
    },
    "electronicAddress": "einkauf@acme.example",
    "electronicAddressSchemeId": "EM"
  },

  "lines": [
    {
      "id": "1",
      "name": "Altmetalllieferung (Stahlschrott)",
      "description": "Lieferung von Schrott und Altmetallen gem. Anlage 3 zu §13b Abs. 2 Nr. 7 UStG (Reverse-Charge)",
      "quantity": 5000,
      "unitCode": "KGM",
      "unitPrice": 0.3,
      "lineAmount": 1500.0,
      "vatCategoryCode": "AE",
      "vatRate": 0
    }
  ],

  "vatBreakdowns": [
    {
      "categoryCode": "AE",
      "rate": 0,
      "taxableAmount": 1500.0,
      "taxAmount": 0.0,
      "exemptionReason": "Steuerschuldnerschaft des Leistungsempfängers für Lieferungen von Schrott und Altmetallen gem. §13b UStG",
      "exemptionReasonCode": "VATEX-EU-AE",
      "reverseChargeReason": "scrap-and-waste"
    }
  ],

  "taxExclusiveAmount": 1500.0,
  "taxAmount": 0.0,
  "taxInclusiveAmount": 1500.0,
  "duePayableAmount": 1500.0,

  "paymentMeans": {
    "code": "58",
    "iban": "DE89370400440532013000",
    "accountName": "Schrotthandel Weber GmbH",
    "bic": "COBADEFFXXX"
  },

  "note": "Steuerschuldnerschaft des Leistungsempfängers (§13b UStG, Schrott/Altmetalle)."
}
