{
  "id": "RE-2026-0058",
  "typeCode": "380",
  "issueDate": "2026-07-21",
  "dueDate": "2026-08-20",
  "currencyCode": "EUR",
  "businessProcessType": "urn:fdc:peppol.eu:2017:poacc:billing:01:1.0",
  "buyerReference": "04011000-12345-03",

  "seller": {
    "name": "Mobilfunk Großhandel Berlin GmbH",
    "vatId": "DE123456789",
    "address": {
      "line1": "Funkerstraße 14",
      "city": "Berlin",
      "postalCode": "10117",
      "countryCode": "DE"
    },
    "electronicAddress": "rechnung@mobilfunk-grosshandel.example",
    "electronicAddressSchemeId": "EM",
    "contact": {
      "name": "Buchhaltung",
      "telephone": "+49 30 1234567",
      "email": "buchhaltung@mobilfunk-grosshandel.example"
    }
  },

  "buyer": {
    "name": "Acme GmbH",
    "vatId": "DE987654321",
    "address": {
      "line1": "Marienplatz 1",
      "city": "München",
      "postalCode": "80331",
      "countryCode": "DE"
    },
    "electronicAddress": "einkauf@acme.example",
    "electronicAddressSchemeId": "EM"
  },

  "lines": [
    {
      "id": "1",
      "name": "Mobilfunkgeräte (Smartphones)",
      "description": "Lieferung von Mobilfunkgeräten (Smartphones) gem. §13b Abs. 2 Nr. 10 UStG, Anlage 4 (Reverse-Charge); Nettoentgelt ≥ 5.000 EUR",
      "quantity": 50,
      "unitCode": "C62",
      "unitPrice": 120.0,
      "lineAmount": 6000.0,
      "vatCategoryCode": "AE",
      "vatRate": 0
    }
  ],

  "vatBreakdowns": [
    {
      "categoryCode": "AE",
      "rate": 0,
      "taxableAmount": 6000.0,
      "taxAmount": 0.0,
      "exemptionReason": "Steuerschuldnerschaft des Leistungsempfängers für die Lieferung von Mobilfunkgeräten gem. §13b UStG",
      "exemptionReasonCode": "VATEX-EU-AE",
      "reverseChargeReason": "mobile-devices"
    }
  ],

  "taxExclusiveAmount": 6000.0,
  "taxAmount": 0.0,
  "taxInclusiveAmount": 6000.0,
  "duePayableAmount": 6000.0,

  "paymentMeans": {
    "code": "58",
    "iban": "DE89370400440532013000",
    "accountName": "Mobilfunk Großhandel Berlin GmbH",
    "bic": "COBADEFFXXX"
  },

  "note": "Steuerschuldnerschaft des Leistungsempfängers (§13b UStG, Mobilfunkgeräte)."
}
